sub_story_id,original_event_id,title,sub_title,detail_title,detail_description,dvs_story_type,is_last,condition_quest_id,reward_type_1,reward_id_1,reward_count_1,reward_type_2,reward_id_2,reward_count_2
5118061,10118,"페코린느와의 만남","푸른 하늘 아래 알현","플리 마켓 현장","플리 마켓을 찾은 지타가 만난 것은\n성을 몰래 빠져나온 페코린느였다.",2,0,0,7,2834,1,8,91002,40
5118062,10118,"마호와의 만남","미래의 기공단\n마스코트?","플리 마켓 현장","지타 일행이 플리 마켓을 돌고 있는데,\n노점을 연 마호가 말을 건다.",2,0,0,7,2835,1,8,91002,40
5118063,10118,"아키노와의 만남","아가씨의\n긴급 의뢰","랜드솔 시가지","지타가 기공단에 들어온 의뢰를 확인하고 있는데,\n 아키노가 소리 높여 웃으며 나타난다.",2,0,0,7,2837,1,8,91002,40
5118064,10118,"쥰과의 만남","황금색 고민거리","플리 마켓 현장","지타 일행은 플리 마켓 현장에서\n살짝 곤란해 보이는 쥰을 발견한다.",2,0,0,18,4108402,1,8,91002,40
5118065,10118,"카오리와의 만남","작열! 격투 대회!","플리 마켓 현장","플리 마켓 한편에서 열리는 격투 대회……\n그곳에는 카오리의 모습도……?",2,0,0,18,4107402,1,8,91002,40
5118066,10118,"니논과의 만남","큰 축제 북은 오에도의 꽃","오에도 마을","태고제를 앞둔 오에도 마을……\n지타는 곤란해 보이는 니논과 만난다.",2,1,0,16,9000227,1,8,91002,40
5118067,10118,"스즈나와의 만남","인기인은 늦게\n나타난다","플리 마켓 현장","비카라는 이벤트에 출연 중인 스즈나를 발견한다.\n그러나 스즈나는 어딘가 곤란해 보이는데……?",3,0,0,19,2101181,1,8,91002,40
5118068,10118,"나나카와의 만남","무녀 meets 마법 소녀","랜드솔 시가지","비카라 일행이 마을을 산책하고 있는데, 지나가던\n나나카가 흥분한 모습으로 다가오더니……?",3,0,0,18,4109402,1,8,91002,40
5118069,10118,"캬루＆콧코로와의 만남","생쥐 귀는 두 번 없어진다","플리 마켓 현장","생쥐 귀를 잃어버리고 절망하는 비카라. 그즈음\n캬루와 콧코로는 길에서 분실물을 줍는데……",3,0,0,18,4305402,1,8,91002,40
5118070,10118,"유카리와의 만남","이 만남에 건배!","랜드솔 시가지","마을 외곽에서 휴식을 취하던 비카라 일행은\n한껏 흥이 오른 모습의 유카리와 만난다.",3,0,0,18,4101402,1,8,91002,40
5118071,10118,"아오이와의 만남","음양 앙상블","랜드솔 시가지","비카라는 인파에 겁먹은 아오이가 걱정되어,\n명랑하게 말을 걸지만……",3,0,0,18,4106402,1,8,91002,40
5118072,10118,"시노부와의 만남","운을 시험하는 열 번의 승부!","플리 마켓 현장","비카라가 플리 마켓 현장을 걷고 있는데,\n점을 치고 있던 시노부가 말을 건다.",3,1,0,7,2836,1,8,91002,40
5118600,10118,"오프닝","그녀들의 새로운 일상",0,0,1,0,10118115,0,0,0,0,0,0
