unlock_story_id,disp_order,title,description,glossary_id,glossary_category_id,category_type
0,50,"아쿠도이 상회","악당 「아쿠도이」가 회장인 악덕 상회. 사채, 납치, 불법 무기 밀수입 등, 나쁜 짓은 무엇이든 한다. 아쿠도이의 말투는 정중하지만 극악무도한 사람이다. 진짜 악당은 종종 그런 것이다.",1001,2,1
0,48,"아스트라이아 대륙","세계 최대의 대륙. 대륙 중심에는 거대 도시ㆍ랜드솔이 있고, 그 상공에는 솔의 탑이 하늘 높이 솟아있다.",1002,2,1
0,49,"아스트룸","이 세계 전체를 나타내는 단어. 아스트라이아 대륙의 어원이기도 하다. 하지만 「아스트룸」의 어원은 확실치 않다.",1003,2,1
0,47,"아메스","주인공의 꿈에 나타나는 수수께끼의 소녀. 주인공의 과거를 아는 듯한 말투로 이야기한다. 시니컬한 말투와 파손된 날개가 특징. 콧코로는 아메스를 신으로 섬기며 각종 신탁을 받고 있다.",1004,2,1
0,2,"걸어 다니는 회오리","안네로제 폰 슈테히파름의 또 다른 이름. 글자 그대로 마을을 걸어 다니는 것만으로 회오리처럼 끊임없이 무슨 일을 일으키기에, 자연스럽게 그녀를 그렇게 부르는 자들이 늘어났다. 회오리라는 단어가 마음에 들었는지 별칭으로 부르면 기분 좋게 이름을 말해준다.",1005,1,1
0,52,"안네로제 폰 슈테히파름","안나의 진명. 어떤 상대에게라도 일단 이름을 대는 것이 안나의 방침.",1006,2,1
0,27,"마안(이블 아이)","나, 질풍의 명희는 좌안에 대량의 마력을 모을 수 있노라! 매우 강력한 마법을 쓸 때, 나의 눈동자는 이계의 빛을 내뿜는다!",1007,2,1
0,34,"바이스플뤼겔","모니카가 그녀의 조국에서 소속된 부대의 이름. 바이스=흰색, 플뤼겔=날개라는 의미다. 그 이름을 널리 알리기 위해 모니카는 오늘도 활동한다.",1008,2,1
0,35,"바이스플뤼겔 랜드솔 지부","모니카를 길드 마스터로 하여 결성된 길드. 멤버는 모니카, 니논, 유키, 쿠우카, 아유미, 이렇게 다섯 명. 결성「되었다」라고 하기보다, 어쩌다 보니 결성「되어 버렸다」라고 하는 편이 맞는 뉘앙스 같다. 멤버들은 언제나 멍청한 행동으로 위기에 처하지만, 알아서 화려하게 해결한다. 그 때문에 이 길드는 덜떨어진 녀석밖에 없는 건지, 잠재 능력이 높은 건지, 아직도 판단이 내려지지 않았다.",1009,2,1
0,59,"위스타리아가","아스트라이아 대륙 전역에 랜드솔 제일의 상인 집안이라고 이름을 떨친 명문가. 그중에서도 수많은 파워풀한 일화 때문에 「아키노･위스타리아」 아가씨의 이름은 특히나 랜드솔에 널리 알려졌다. 좋은 의미로도 나쁜 의미로도.",1010,2,1
0,37,"베리오 화산","아스트라이아 대륙에서 가장 거대한 화산. 현재도 빈번히 분화하는데다, 마물도 많이 서식하는 위험한 지역이다.",1011,2,1
0,54,"에스트렐라 가도","아스트라이아 대륙에 있는 녹음이 우거진 길. 기후가 좋은 지역이어서 서식하는 식물, 동물, 곤충의 종류도 많다. 길을 걷다 보면 각종 생물을 만날 수 있다.",1012,2,1
0,46,"심연유구=취상열공참(이터널 어비스=디바이더)","검에 깃든 마력을 참격으로 해방하는 마법. 고밀도로 압축된 마력은 굉장한 위력을 자랑하며 스치기만 해도 치명상을 입힌다.",1013,2,1
0,56,"엘프족","아스트룸에 사는 네 종족 중 하나. 뾰족하고 긴 귀가 외형적인 특징. 일반적으로 다른 종족보다 지능이 높고, 마법을 사용할 수 있는 이들도 많다. 자연을 사랑하여 숲에서 많이 살지만, 최근에는 랜드솔에 정착하는 이들이 늘고 있다.",1014,2,1
0,55,"엘프의 숲","아스트라이아 대륙에 있는 자연이 풍부한 숲. 대륙에 있는 엘프 중에는 이곳에서 태어난 이가 많고, 날 때부터 식물이나 동물 등 여러 생명과 함께 살아왔다.",1015,2,1
0,62,"인연의 꽃","베리오 화산에서 드물게 서식하고 있는 식물 중에서도 가장 진귀한 종류의 꽃. 그 희소성 때문에 「마음에 든 상대에게 건네면 사랑이 이뤄진다」라는 소문이 있다.",1016,2,1
0,57,"오랄 고산","아스트라이아 대륙에 있는 험한 고산. 베리오 화산으로 이어지는 산길이 있지만 그 길은 무척이나 가혹하기 때문에 사람들이 다가가지 못한다.",1017,2,1
0,61,"음향판","음성을 기록한 특수한 마석. 마력을 흘려 넣으면 기록된 소리가 재생되는 방식으로, 원반 모양으로 가공된 것이 유통되고 있다. 크기에 비례하여 재생할 수 있는 시간이 길어진다. 예전에는 소리를 장시간 들으려면 계속해서 마력을 흘려 넣어 줄 사람이 필요했기 때문에 왕족이나 부자들만 가지고 있었다. 하지만 수십 년 전, 마력을 모아둘 수 있는 돌로 음향판에 마력을 흘려보내는 방식을 탑재한 재생기기가 만들어진 이후 폭발적으로 보급되었다. 지금은 장치가 저렴해져서 누구나 쉽게 음악을 즐길 수 있게 되었다.",1018,2,1
0,63,"자경단(카온)","【동물원】의 하위 조직. 주로 【동물원】의 동료들을 마물의 위협으로부터 지키는 무도파 길드. 「섀도우」와 같은 이변을 조사하거나 해결하기도 한다. 【왕궁기사단(NIGHTMARE)】과는 견원지간이라 항상 대립하며 크고 작은 다툼이 끊이지 않는다.",1019,2,1
0,69,"카지노","랜드솔 내에 있는 오락시설. 룰렛, 카드 게임 등을 하며 놀 수 있다. 시간 때우기부터 일확천금까지…… 사람들의 희망과 절망으로 매일 떠들썩하다.",1020,3,1
0,68,"카르미나","솔로로 아이돌 활동을 하던 노조미가 길드 마스터인 아이돌 길드. 노래하고 춤추며 (슬픈 마음과) 싸우는 길드로 라이브 공연 등의 행사가 주된 활동 내용이다.",1021,3,1
0,30,"맹약 외전 술식 제666장(기아스아포크리포·타이런트 코드)","과거 신에 의해 세계의 뒤편에 봉인된 이 세계의 법칙을 조종하는 방법이 적혀 있는 서적. 안네로제 폰 슈테히파름은 그 안에 기록된 술식 한 구절을 영혼에 새겨, 마안에 모은 마력이 흘러나오지 않도록 하고 있다. 대규모 마법을 사용할 때만 그 술식을 이용해 마력을 온몸에 불어넣는다.",1022,2,1
0,6,"길드","특정한 목적을 가지고 활동하는 사람들의 집합체. 랜드솔에서는 「길드」에 가입하는 것이 국민의 의무다. 길드에 소속됨으로써 받을 수 있는 공공 서비스도 있으며, 도리어 가입하지 않으면 사회적 신용을 얻을 수 없는 등의 단점도 많다. 길드의 목적은 다종다양해서, 상업, 군사, 문화 사업 등 랜드솔의 각종 산업을 지탱하고 있다. 또한, 1명이 여러 길드에 가입하는 것도 가능하다.",1023,1,1
0,7,"길드 관리 협회","랜드솔의 길드를 관리하는 공공 기관. 길드는 관리협회에 의해 엄격히 관리되고, 활동 실태가 없는 길드는 해산 처분된다. 하지만 범죄 집단 같은 반사회적인 비공식 길드도 존재한다.",1024,1,1
0,8,"길드 하우스","길드를 결성한 랜드솔 국민들에게 주어지는 활동 거점. 길드의 활동 규모나 업적에 따라 시설을 확충하거나 재건축할 수 있다.",1025,1,1
0,70,"크리스탈 마운틴","과거에는 수정 발굴로 번성했던 장소였지만, 현재에는 당시를 떠올리게 하는 낡은 성 하나만 볼품없이 산 속에 서 있다. 그 역사를 아는 자는 적다.",1026,3,1
0,80,"효율충","효율을 최우선으로 여기며 움직이는 사람을 가리킨다. 간단히 말하자면 미후유 같은 사람. 게임과 같은 놀 거리가 있으면 공략본을 가까이에 두고 읽으면서 공략하는 타입.",1027,3,1
0,4,"골렘","마법사가 만든 유사 생명체. 창조주의 명령을 충실히 실행한다. 진흙이나 광석 등, 각종 물질로 생성되며 크기도 능력도 다종다양하다.",1028,1,1
0,45,"수집가(콜렉터)","마법 관련 서적뿐만 아니라, 소설 같은 문예서나 흥미로운 고대 유산 등, 각종 물건을 모으며 각지를 돌아다니는 나나카에게 붙은 별칭. 본인은 아직 그 이름이 어울리지 않는다고 생각한다.",1029,2,1
0,40,"샐러맨더의 피","화산에 사는 마물･샐러맨더의 혈액으로, 높은 용해 능력을 가지고 있다. 부식 능력이 높아 인체에 몹시 해롭다. 샐러맨더도 자신의 혈액 때문에 부식되어 죽는다고 한다.",1030,2,1
0,39,"사렌디아 구호원","원래 【왕궁기사단(NIGHTMARE)】의 부단장이었던 사렌이 통솔하고 운영하는 길드. 고아원이지만 다양한 물품의 거래도 한다. 왕궁 경호로 따분하기 그지없는 나날에 가치를 찾지 못한 사렌이 사람들에게 도움이 되는 일을 하고 싶어 운영을 시작했다.",1031,2,1
0,67,"치염전귀연옥혈맹암흑단(디 오더 오브 게헤나 이모탈스)","안네로제 폰 슈테히파름이 전생에 소속되어 있던 암흑기사단. 「암흑기사들은 과거 악에 타락하였다. 하지만 세계를 뒤덮는 어둠의 존재 《별의 재정자》를 멸하기 위해, 같은 어둠의 힘을 사용하여 그들에게 맞설 것을 결심했다. 이윽고 별의 재정자와의 전투 중, 암흑기사들은 모두 목숨을 잃고 말았다……」(『명풍전기』 개요에서 발췌)",1032,3,1
0,41,"섀도우","사람의 모습을 한 특수한 마물. 사람의 언어를 말하지만, 문맥이 없는 단어의 나열이기 때문에 지능이 없다고 추측된다. 랜드솔에서 목격되는 빈도가 급격히 증가하여 문제시되고 있다.",1033,2,1
0,42,"솔 오브","솔의 탑 정상에 도달하기 위해서 필요하다고 전해지는 반투명한 구체. 지금은 그 전승을 믿는 자가 거의 없어, 옛날이야기 속의 존재로 취급된다.",1034,2,1
0,43,"솔의 탑","랜드솔 중심에 우뚝 솟은 거대한 탑. 아스트라이아 대륙에서 가장 큰 건축물인 동시에 가장 큰 미스터리이기도 하다.",1035,2,1
0,9,"단팥빵","린이 가장 좋아하는 것. 때로는 월급의 대부분을 단팥빵 사 먹는 데 쓸 때도 있다. 으깬 팥, 거른 팥이 있는데 취향 싸움이 길게 이어지고 있다.",1036,1,1
0,3,"게임","최근에 만들어진 장난감. 하드라는 마법도구에, 특수한 광석을 사용한 소프트라는 기억매체를 장착해서 놀 수 있다. 고도의 기술로 만들어졌기에 가격이 상당히 비싸다.",1037,1,1
0,5,"괜찮아 마이 프렌드 군 1호","아오이가 엘프의 숲에 떨어져 있는 고철을 주워 모아 만든 인형. 아오이의 친구 만들기 연습 상대로 매일 이야기 상대가 되고 있다. 일명 「마이 프렌드 군」. 기본적으로 아오이가 마이 프렌드 군에게 일방적으로 이야기할 뿐이지만, 아오이의 상상 속에서는 완벽하게 대화가 통한다고 생각한다.",2001,1,1
0,79,"황혼의 도시","이 세계 어딘가에 있다고 전해지는 장소. 먼 옛날 번영했다고 하는 도시로, 각종 기술이 발전했다고 전해진다. 황혼의 도시의 전설은 몇 개나 있고 「결코 부러지지 않는 무기를 만드는 도공」, 「별을 오가는 비공정」 등이 유명하다.",2002,3,1
0,66,"초능력","보통 사람은 할 수 없는 것을 실현할 수 있는 초자연적이고 특수한 신체능력. 시스템적인 학습이나, 주문 영창이 필요 없다는 점이 마법과는 다르다. 현재까지 초능력을 가진 사람은 확인되지 않았다. 하지만 하늘을 떠다니는 인간을 본 목격 정보가 있어, 마법인지 초능력인지 논쟁이 있다.",2003,3,1
0,71,"통신 마법","아스트라이아 대륙에서 사용되는 원거리 전달용 마법. 공공 기관 또는 사설 단체에 소속된 마술사가 인프라가 정비된 마법망으로 통신하는 것과 개인의 마술로 행하는 것, 두 종류가 있다. 둘 다 고위 마법으로 대량의 마력을 사용하기에 정밀도가 높지 않고 장애도 일어나기 쉽다.",2004,3,1
0,51,"악마왕국군(디아볼로스)","이리야 온스타인이 마족 소녀들과 결성한 길드. 길드명은 일찍이 신들을 상대로 투쟁을 벌인 이리야가 이끌었던 최강의 마족 군대와 같다.",2005,2,1
0,74,"파괴사(디스트로이어)","때로는 경호원으로서 실력을 발휘하는 에리코에게 붙은 별칭.",2007,3,1
0,64,"전설의 흡혈귀","아주 먼 옛날, 마족을 이끌고 신들과 싸웠다는 마족의 여왕. 마족 사이에서는 유명한 옛날이야기이지만, 실제로 존재했다고 생각하는 이도 적지 않다. 「전설의 대마왕」, 「전설의 마녀」 등으로도 불린다.",2008,2,1
0,73,"트윙클 위시","히요리, 유이, 레이 셋으로 결성된 남을 돕는 길드. 길드 마스터는 히요리로, 곤란한 사람을 돕는 일이 주된 활동 내용이다. 하지만 진정한 목적은 지금까지 같은 꿈을 꿔 온 세 사람이 모두 함께 바라는 「솔의 탑 정상에 도달」하는 것이다.",2009,3,1
0,12,"동굴","아스트라이아 대륙 땅속에 생긴 동굴. 마물의 소굴이 된 경우도 많기 때문에 일반적으로 위험 지역으로 분류된다. 또한 불법 거래나 도적 등의 은신처가 된 곳도 있다. 사후세계로 가는 입구로 여겨져 무덤으로 사용되기도 한다.",2010,1,1
0,13,"동물원","수인족(비스트)들의 조직인 길드. 랜드솔에서 지내는 수인족(비스트)은 거의 대부분 【동물원】에 소속되어 지원을 받고 있다. 【프린세스 나이트】와 필적하는 대규모 길드이지만, 개개인의 참여 의식이 희박하기 때문에 길드의 전체 모습은 누구도 파악하지 못했다. 수많은 길드들의 연합체로 【자경단(카온)】, 【목장(엘리자베스 파크)】 등 하위 조직들이 있다.",2011,1,1
0,11,"동국","니논이 동경하는 랜드솔에서 멀리 떨어진 동쪽에 있다는 나라. 닌자, 사무라이, 게이샤, 후지산…… 등, 수많은 이국적인 것이 있다고 한다.",2012,1,1
0,72,"트와일라이트 캐러밴","황혼의 도시를 찾는 자들이 정보 수집을 위해 모인 길드. 길드 마스터는 루카. 루카 이외의 멤버들은 별칭으로 불릴 정도로 유명해서, 결성된 이후에는 랜드솔에서 가장 위험한 길드가 탄생했다는 소문이 돌고 있다.",2013,3,1
0,58,"왕궁기사단(NIGHTMARE)","【프린세스 나이트】의 본 부대라고 할 수 있는 기사단 길드. 길드 마스터는 「단장」이라 불린다. 이른바 랜드솔의 국군으로 「왕궁」 및 왕족의 호위, 또 칙명을 통해 받는 임무의 달성이 활동 목적이다. 동시에 마을의 치안을 지키는 경찰 조직의 측면도 강하다. 왕후 귀족이 주요 관직을 맡는 것이 전통이기에 시민계급 출신의 기사는 왕궁 내에 들어가지 못하는 등의 제약도 많다.",2014,2,1
0,29,"마차","아스트라이아 대륙의 주된 교통수단. 비공정과 같은 고도의 마법 이동 장치도 존재하지만, 상당히 고가이기 때문에 육로에서는 주로 마차가 사용된다. 랜드솔과 외부 촌락을 연결하는 개인 소유의 정규편도 많이 있다.",2015,2,1
0,44,"수인(비스트)족","아스트룸에 사는 네 종족 중 하나. 휴먼족 다음으로 인구가 많다. 여러 짐승의 특징을 가지고 있으며 일반적으로 다른 종족보다 신체 능력이 뛰어나다. 외형적인 특징으로는 짐승의 귀와 꼬리가 있다.",2016,2,1
0,33,"미식전","길드에 소속된 사람만 들어갈 수 있는 음식점 등에 가기 위해 페코린느가 결성한 길드. 목적은 맛집 탐방. 막 만들어졌기에 구성 인원도 적은 약소 길드.",2017,2,1
0,81,"휴먼족","아스트룸에 사는 네 종족 중 하나. 가장 인구가 많은 종족이다. 랜드솔의 시정은 휴먼족 귀족을 중심으로 이루어지기 때문에, 자신이 휴먼족이란 것에 특권 의식을 가진 자도 있어서 다른 종족을 박해한 사례도 있다.",2018,3,1
0,75,"팬텀 캣","최근 랜드솔에서 화제가 된 수수께끼의 미소녀 의적. 극성맞은 악인의 집에 침입해 훔친 보석을 가난한 서민들에게 나눠준다. 그 정체는 의문에 싸여 있지만, 타마키는 「패, 팬텀 캣의 정체? 모, 모른다냥. 하지만 무척 귀엽고 고양이를 사랑하는 의적이라고 들었다냥. 앞으로도 팬텀 캣을 잘 부탁한다냥!」라고 했다. 팬텀 캣…… 도대체 정체가 뭘까……",2019,3,1
0,76,"포레스티에","엘프족이 사는 숲을 관리하고 수호하고 있는 역사가 긴 길드. 현재의 길드 마스터는 미사토. 엘프의 숲에만 나는 약초 등의 교역품을 관리하거나, 다른 종족이 숲에 방문했을 때 가이드를 하는 등, 활동 내용은 다양하다.",2020,3,1
0,77,"프라노 평원","아스트라이아 대륙에 펼쳐진 평원. 가도에서 멀리 떨어져 사람 손이 닿지 않은 자연의 토지이기 때문에 마물도 많이 서식하고 있다. 마을에서 가깝기도 해서, 자신의 실력을 시험하고자 찾는 무예자가 끊이지 않는다.",2021,3,1
0,38,"브리자 계곡","아스트라이아 대륙에 있는 계곡. 산들바람이 부는 특수한 지형으로, 기분 좋은 바람이 이곳을 찾는 모험자들을 반겨준다.",2022,2,1
0,78,"프린세스 나이트","랜드솔을 통치하는 「왕궁」 직속 길드. 군사, 우편, 경찰, 소방 등 공공사업을 담당하는 길드의 총칭이 【프린세스 나이트】이며, 수많은 하위 조직이 있다. 왕족, 특히 군주인 공주(프린세스)를 수호하는 기사(나이트)이기 때문에 그런 이름이 붙었다고 한다.",2023,3,1
0,1,"BB단","정식 명칭은 「바이바이 외톨단」. 아오이와 주인공이 친구를 만드는 방법을 생각하기 위해 둘이서 결성한 팀. 활동 내용은 다양하지만, 대체로 「친구란 무엇인가」라는 철학과도 닮은 심오한 의제를 탐구하고 있다. 그 모습은 어떤 의미에서는 지적 집단이라고 할 수도 있겠다. 하고 있는 행동은 둘째치고.",2024,1,1
0,36,"방범 마석","위험한 상황에 처했을 때 스위치를 누르면, 큰 소리의 경고음을 내는 호신용 아이템. 주로 어린아이가 외출할 때 가지고 다닌다. 그 효과는 소음을 내는 정도의 것에서부터 초음파를 발생시켜 상대의 청력을 파괴하는 것까지 다양한 종류가 있다.",2025,2,1
0,32,"목장(엘리자베스 파크)","산 위에 있는 목장 길드. 활동 내용은 목장에서 소나 말 등의 가축을 기르는 축산업이지만, 수인족(비스트)들이 휴가를 오는 피크닉 장소이자 환자들의 요양지 역할도 한다. 평소 마을 일에 거의 관여하지는 않지만, 우유나 고기 등을 거래하려는 상인의 출입은 활발하다.",2026,2,1
0,10,"도토리","린이 단팥빵 다음으로 좋아하는 것으로 품종에 따라 맛도 다양하다. 린이 말하길, 어디에서든 집어 먹을 수 있도록 항상 가지고 다닌다고 한다.",2027,1,1
0,28,"마족","아스트룸에 사는 네 종족 중 하나로 가장 인구가 적다. 머리에 두 개의 뿔이 있는 것이 외형적인 특징이다. 마력, 지력, 운동, 감각 등 뛰어난 특정 능력을 가진 이들이 많다. 과거 신들과 세계 패권을 놓고 겨뤘다는 전설도 있는 고결한 일족.",3001,2,1
0,26,"마법구","제작 과정에 마법을 첨가함으로써 언제든 그 효과를 발휘할 수 있는 도구. 충격 흡수 마법을 첨가한 방어구, 힘을 상승시키는 팔찌가 유통되고 있다. 하지만 마법 효과는 원래보다 낮아져 버린다. 마법을 몰라도 마력이 있으면 쓸 수 있는 것도 있어, 마족이나 휴먼족에게 인기 있다. 드물게 부작용이 일어나는 경우가 있기 때문에 사용 시 주의가 필요하다.",3002,2,1
0,25,"마법 소녀 베루루","랜드솔에 전해지는 아동 문학. 과거에 존재한 전설의 영웅을 모델로 한 이야기로 대중연극의 소재로 자주 등장한다.",3003,2,1
0,23,"마물","아스트라이아 대륙에 서식하는 수수께끼의 생물. 매우 포악해서 인류와 동물들의 생활을 위협한다.",3004,2,1
0,24,"마물 토벌","사람들의 생활을 위협하는 포악한 마물을 배제하기 위한 박멸, 토벌 행위. 토벌로 채취하는 고기, 가죽, 기름, 뼈, 뿔, 깃털 등은 생활용품으로도 이용되어, 사냥 자체를 생업으로 하는 자도 있다. 반면 때때로 발견되는 포악하지 않은 마물은 돌연변이로 조사를 위해 보호 대상이 된 것도 있다.",3005,2,1
0,53,"액막이 아뮬렛","유령, 마물, 재액 등으로부터 소지자를 지키는 부적. 신의 치유를 담은 성석 등의 매직 아이템이 사용된다.",3006,2,1
0,22,"마르젠 해안","아스트라이아 대륙의 해안. 근처에는 작은 마을이 있고, 때때로 축제가 열리는 밤에는 야광화가 마을을 아름답게 비춘다. 바다에 마물이 출현할 때도 있기 때문에, 마물 퇴치 의뢰를 받은 무예자들이 올 때도 있다.",3007,2,1
0,31,"메르쿠리우스 재단","아키노가 위대한 상인인 아버지로부터 「어엿한 상인이 되거라」는 말을 듣고, 그 목표를 달성하기 위해서 결성한 길드. 막대한 자금을 밑천으로 각종 사업의 융자와 매수를 한다. 의적으로 활동하는 타마키와 함께 악덕한 방법으로 돈을 버는 상인들에게 본때를 보여주는 것이 이면의 활동 목적.",3008,2,1
0,60,"유령","인간이나 동물이 죽은 후 성불하지 못하고 육신 없는 정신체가 된 존재. 실재하는지 아닌지, 랜드솔 내에서도 논쟁이 있지만 결론이 나지 않았다. 최근에는 푸딩 등을 판매하는 제과점에서 봤다는 목격 정보가 많지만, 시뮬라크르 현상이라는 의견도 있다.",3009,2,1
0,14,"라비린스","수수께끼의 인물, 라비리스타가 결성한 세계의 수수께끼를 탐구하는 길드. 신뢰할 수 있는 극소수의 인원으로 구성되었다. 표면적으로는 크레이프 가게를 운영하며 평범한 길드를 가장한, 이른바 비밀결사.",3010,1,1
0,15,"랜드솔","아스트라이아 대륙 최대의 국가. 또한 수도인 동시에 성채 도시.",3011,1,1
0,16,"랜드솔 왕가","랜드솔의 시정을 관장하는 군주와 그 일족. 랜드솔은 전통적으로 왕의 장녀가 군주가 되는 모계 국가. 왕족은 왕성에서 거주하며 【왕궁기사단(NIGHTMARE)】의 삼엄한 보호를 받는다.",3012,1,1
0,20,"리얼충","본래 의미는 현실을 충실히 사는 사람을 가리키는 단어. 하지만, 유카리는 「최근 너 나 할 것 없이 『애인이 있는 사람』이라는 의미로만 쓰고 있잖아! 나도 말야, 혼자지만 충실히 현실을 산다고! 으으…. 확 폭발해 버려!」라고 했다. 이유야 어찌 되었든 폭발하는 것을 강하게 바라고 있는 것 같다.",3013,1,1
0,21,"리틀 리리컬","미미, 미소기, 쿄우카, 이 사이좋은 세 사람이 결성한 길드. 길드 목적은 그저 노는 것. 길드 관리 협회의 인가를 받은 정식 단체가 아니라, 단지 셋이서 길드 흉내를 내며 노는 것이다.",3014,1,1
0,18,"루센트 학원","랜드솔에 있는 학교 중 하나. 길드 관리 협회가 운영하는 공립 교육기관. 남녀공학이며 통학하는 학생의 연령, 종족, 학력도 다양하다. 주로 학력별로 반을 나눈다. 또한 랜드솔에는 의무교육이 없지만, 교육 관련 길드의 발달로 지식수준이 높다. 문맹률이 거의 0％",3015,1,1
0,19,"루피","아스트라이아 대륙에서 유통되는 화폐의 단위. 지폐도 동전도 있다. 1,000루피로 한 끼 식사를 할 수 있을 정도의 가치가 있다.",3016,1,1
0,17,"로스트","분명히 존재해야 할 인물의 기록과 기억이 사라지는 기이한 현상. 예를 들어 어린이에게는 반드시 부모가 있을 테지만, 자료를 조사해도 그 존재가 확인되지 않고, 아이도 부모에 대한 아무런 기억이 없다. 이 기이한 현상 때문에 보호자가 없어 갈 곳이 없는 아동이 사회문제가 되고 있다.",3017,1,1
0,65,"척안의 악마(원 아이드 데빌)","예전에는 그 이름을 입 밖으로 꺼낸 것만으로도 대륙 전체의 악인들이 두려움에 떨었다는 존재. 그 정체는 미츠키. 연구를 방해한 자들을 물리치는 과정에서 그 이름으로 불리게 되었다. 평소에는 안대 밑에 감춰두고 있는 왼쪽 눈을 뜰 때, 지옥이 생겨난다고 한다.",3018,3,1
