description,frame_id,start_time,group_id,frame_name
"스토리 이벤트 「엔조이＆리프레시! 울퉁불퉁 걸즈 캠프」의\n미션 「아스트라이아 모조 버섯 1마리를 쓰러뜨리자(HARD 한정)」를 달성하면 확인할 수 있습니다.",2100941,"2023/06/29 15:00:00",1,"엔조이＆리프레시! 울퉁불퉁 걸즈 캠프"
"스토리 이벤트 「트윙클 서머 게임 여름 바다에 빛나는 세 가지 마음」의\n미션 「해상 장관 해마 커맨더 1마리를 쓰러뜨리자(HARD 한정)」를 달성하면 확인할 수 있습니다.",2100961,"2023/08/01 15:00:00",2,"트윙클 서머 게임 여름 바다에 빛나는 세 가지 마음"
"스토리 이벤트 「리틀 서머 메모리즈 물가에서 찾아낸 작은 행복」의\n미션 「문 레이 게이트 1마리를 쓰러뜨리자(HARD 한정)」를 달성하면 확인할 수 있습니다.",2100981,"2023/08/30 15:00:00",3,"리틀 서머 메모리즈 물가에서 찾아낸 작은 행복"
"스토리 이벤트 「마호마호 미라클 저니! 여행하는 소녀와 땅끝의 커다란 나무」의\n미션 「애집의 바로메츠 1마리를 쓰러뜨리자(HARD 한정)」를 달성하면 확인할 수 있습니다.",2101001,"2023/09/25 15:00:00",4,"마호마호 미라클 저니! 여행하는 소녀와 땅끝의 커다란 나무"
"스토리 이벤트 「커넥트 위드 블루 소녀가 하늘에 닿기까지」의\n미니 콘텐츠 「랜드솔 한 번뿐인 인연」의 「인기인은 늦게 나타난다」를 열람하면 확인할 수 있습니다.",2101181,"2024/05/28 15:00:00",5,"부유섬과 비공정 프레임"
