detail,batter_id,meet,critical,pkb_score,is_playable,power,ability_name,name,ability_detail
"",1,1,2,0,1,1,---,"아야네",""
"역경에 굴하지 않고 부원들을 이끄는 주장. 결정력 있는 스윙을 살린 안정감 있는 타격이 특기.",2,0,1,6000,1,3,---,"아사히",""
"무뚝뚝하지만 동료를 소중히 생각하는 마음은 누구보다 강한 남자. 싸움으로 단련된 힘이 주특기인 파워 타자.",3,3,3,16000,1,0,"아드레날린","부원3","홈런을 연발하면 연발한 수에 따라 파워업한다"
"모두에게서 두터운 신뢰를 모으는, 기대받는 조력자 부원. 실력은 미지수지만 행운의 해프닝을 불러온다.",4,2,2,30000,1,2,"럭키",{0},"행운의 해프닝을 불러온다"
"아무도 모르는 극비 정보가 실려있는 보너스 페이지. 결코 누구에게도 보여서는 안 된다.",5,1,0,50000,0,1,"","선수 명부 보너스 페이지",""
"",6,0,1,50000,0,1,"","선수 명부 보너스 페이지",""
"",7,0,0,50000,0,0,"","선수 명부 보너스 페이지",""
"",8,1,0,50000,0,0,"","선수 명부 보너스 페이지",""
"",9,0,0,50000,0,0,"","선수 명부 보너스 페이지",""
