event_type,tutorial_type,tutorial_image_id,id,tutorial_text
1,1,1,1011,"イベントでは、特別なストーリーをお楽しみいただけます。\n閲覧可能なストーリーを読むと、次のお話が解放されていきますよ。\nストーリーの閲覧によって達成されるミッションもあるのだとか。"
1,2,2,1021,"イベントクエストやボスバトルに挑戦してみましょう。ボスバトルは\n特定のイベントストーリーを閲覧するか、イベントクエスト・ボス画面で\n「解放する」を選択すると挑戦可能になりますよ。"
1,4,4,1041,"報酬交換では「イベント報酬券」と様々なアイテムを交換できます。\n目玉となるリセット対象報酬を引くことで、より多くのアイテムが\n獲得できる次のラインナップへと進めるそうです。"
1,5,5,1051,"ボスバトルには３種の難易度がございます。\n各難易度ごとにボスの強さやバトルの特徴が異なりますので、\n準備をしっかりして、気を引き締めて挑みましょう。"
1,6,6,1061,"ボスバトルには３種の難易度がございます。\n各難易度ごとにボスの強さやバトルの特徴が異なりますので、\n準備をしっかりして、気を引き締めて挑みましょう。"
