equipment_id,equipment_name,description,promotion_level,craft_flg,equipment_enhance_point,sale_price,require_level,hp,atk,magic_str,def,magic_def,physical_critical,magic_critical,wave_hp_recovery,wave_energy_recovery,dodge,physical_penetrate,magic_penetrate,life_steal,hp_recovery_rate,energy_recovery_rate,energy_reduce_rate,enable_donation,accuracy
131011,"혜애검 서머 러브 패밀리어","여름의 바닷가에서 이오가 학생을 지키기\n위해 휘두르는 검. 학생을 생각하는 타고\n난 마음씨를 치유의 힘으로 바꿔준다. 이\n번 여름에도 틀림없이 대활약할 것이다.",98,1,0,0,1,0.0,0.0,80.0,1.0,1.0,0.0,0.0,0.0,0.0,0.0,0.0,0.0,0.0,6.0,0.0,0.0,0,0.0
131031,"섬려검 서머 브라이트","사렌이 여름에 들고 다니는 검. 구호원의\n마마로서가 아니라, 한 사람의 여성으로서\n도 여름을 즐겼으면 하는 아이들의 소원이\n담겨있다.",98,1,0,0,1,0.0,80.0,0.0,0.0,0.0,0.0,0.0,0.0,30.0,0.0,0.0,0.0,0.0,0.0,0.0,0.0,0,0.0
131041,"서머 울펜 소드","파도 없는 특별한 바다에 나타난다고 전해\n지는 해랑의 엄니를 단련한 대검. 마코토\n가 늑대 장식을 매우 마음에 들어 한다.",98,1,0,0,1,0.0,88.0,0.0,0.0,0.0,20.0,0.0,0.0,0.0,0.0,0.0,0.0,0.0,0.0,1.0,0.0,0,0.0
131051,"류쿠견식 신무지농수","해신인 대해원에게 춤을 바치기 위한 제구\n중 하나인 토시. 천의 무늬에는 바다를\n향한 무수한 감사함이 담겨있고, 토시를\n끼고 춤추는 카오리는 대해를 구현한다.",98,1,0,0,1,0.0,90.0,0.0,0.0,0.0,28.0,0.0,0.0,0.0,0.0,0.0,0.0,0.0,0.0,0.0,0.0,0,0.0
131061,"하화장 팬시 로어","해변에 맞는 성능으로 마호 공주가 만든\n마법 지팡이. 여름의 정경이 갇혀있고,\n한 번 휘두르면 등불이 비추는 실루엣과\n함께 밤하늘에 큰 꽃이 피어난다.",98,1,0,0,1,0.0,0.0,78.0,0.0,0.0,0.0,18.0,0.0,0.0,0.0,0.0,0.0,0.0,0.0,0.0,1.0,0,0.0
131071,"단짝 궁금","성 테레사 여학원에 편입할 때 새로 장만\n한, 외톨이 극복을 위한 아오이의 최종병\n기. 부적 대신이었지만 지금은 인연의 상\n징이 되었다.",98,1,0,0,1,0.0,91.0,0.0,0.0,0.0,24.0,0.0,0.0,0.0,0.0,0.0,0.0,0.0,0.0,0.0,0.0,0,0.0
131081,"프롬 더스크 틸 던","조리・재봉・동생들 미술 숙제 등 다채로\n운 용도에 매일 쓰는 클로에의 만능 도\n구. 그렇게 우기면서 교무 주임 선생님의\n소지품 검사에 절대적인 방어력을 갖는다.",98,1,0,0,1,0.0,77.0,0.0,0.0,0.0,35.0,0.0,0.0,0.0,0.0,0.0,0.0,0.0,0.0,2.0,0.0,0,0.0
131091,"핑크빛☆펜 라이트☆너클","강함과 귀여움을 추구하는 치에루의 수제 해피치에루 너클. 유사시에는 형광 핑크인 손톱을 뚝 꺾으면 발광 마법이 발동해서 동경하는 가희를 응원할 수 있다.",98,1,0,0,1,0.0,79.0,0.0,0.0,0.0,40.0,0.0,0.0,0.0,0.0,0.0,0.0,0.0,0.0,1.0,0.0,0,0.0
131101,"펜슬 도끼 · 레플리카","유니가 겉멋이나 호기심으로 가지고 다니는 칼창 모조품. 중후한 외견과 달리 어린이도 안심인 경량 설계. 자립성은 없고 받침대가 없어지면 탁 쓰러진다.",98,1,0,0,1,0.0,0.0,56.0,0.0,0.0,0.0,0.0,200.0,30.0,0.0,0.0,0.0,0.0,0.0,0.0,1.0,0,0.0
131111,"할로윈 고양이 브룸","할로윈을 위해 쿄우카가 몰래 준비한 검은\n고양이를 모티브로 한 빗자루. 가끔 다리\n를 걸치고 하늘을 나는 상상을 하는 건\n모두에게는 비밀인 것 같다.",98,1,0,0,1,0.0,0.0,96.0,0.0,0.0,0.0,0.0,0.0,0.0,0.0,0.0,0.0,0.0,0.0,0.0,1.0,0,0.0
131121,"마권 트릭 오어 트릭","할로윈을 위해 미소기가 자신만만하게\n준비한 특별한 장난용 장갑. 높은 강도와\n정밀성이 양립하여 어떤 장난에도 딱 맞는\n다는 것 같다.",98,1,0,0,1,0.0,50.0,0.0,4.0,0.0,0.0,0.0,0.0,0.0,1.0,0.0,0.0,0.0,0.0,0.0,0.0,0,8.0
131131,"빙글빙글 토끼씨 블레이드","할로윈을 위해 미미가 어머니와 함께 붕대\n로 칭칭 감아 만든 토끼씨 블레이드. 귀\n여움과 감촉 모두 좋아졌다고 한다.",98,1,0,0,1,0.0,33.0,0.0,0.0,12.0,0.0,0.0,0.0,0.0,0.0,0.0,0.0,0.0,0.0,2.0,0.0,0,0.0
131141,"루나의 친구","루나가 항상 안고 있는 친구. 말 없는 작은 친구는 오늘도 동그란 눈으로 루나를 계속 바라본다.",98,1,0,0,1,0.0,0.0,75.0,0.0,0.0,0.0,0.0,0.0,30.0,0.0,0.0,0.0,0.0,0.0,0.0,1.0,0,0.0
131151,"성각검 아발론","산타클로스 후보가 된 크리스티나의 옷차림에 맞춘 성역검 아발론. 크리스마스이브의 기적으로 인해 주인에게 절대 승리를 선물한다고 한다.",98,1,0,0,1,0.0,86.0,0.0,0.0,0.0,20.0,0.0,0.0,0.0,0.0,0.0,0.0,0.0,0.0,0.0,1.0,0,0.0
131161,"성령검 세인트 호프","산타클로스 후보가 된 노조미의 한 손 검. 아이돌로서의 결의와 많은 사람들을 위한 꿈과 희망의 마음이 그 칼날에 눈부신 빛을 나게 한다.",98,1,0,0,1,290.0,0.0,0.0,12.0,0.0,0.0,0.0,0.0,0.0,0.0,0.0,0.0,0.0,4.0,0.0,0.0,0,0.0
131171,"성야부 노엘 팡","산타클로스 후보가 된 이리야가 애용하는 도끼가 성야의 기적으로 매혹하는 새로운 모습. 호랑가시나무로 예쁘게 장식된 거대 도끼날은 불멸의 빛을 품고 있다.",98,1,0,0,1,100.0,0.0,75.0,0.0,0.0,0.0,8.0,0.0,0.0,0.0,0.0,0.0,0.0,0.0,2.0,0.0,0,0.0
131181,"영춘 미식의 나들이옷","페코린느가 준비한 설날 나들이옷. 왕가 어용상인의 옷감을 쓴 명품으로 옷 전체에 풍요를 기원한 벼 이삭 무늬가 있다. 공주의 위엄과 미식에 대한 경의가 넘친다.",98,1,0,0,1,200.0,70.0,0.0,0.0,0.0,15.0,0.0,0.0,0.0,0.0,0.0,0.0,0.0,0.0,1.0,0.0,0,0.0
131191,"신춘 기행의 정령 지팡이","나들이옷 차림의 콧코로가 지닌 신기가 넘치는 신성한 지팡이. 신춘을 축하하는 무녀의 춤이 주변 동료들에게도 활력을 나눠주고 새해의 행복을 약속한다.",98,1,0,0,1,30.0,0.0,0.0,9.0,10.0,0.0,0.0,0.0,0.0,0.0,0.0,0.0,0.0,0.0,1.0,0.0,0,0.0
131201,"하정 고양이 귀 나무 채","나들이옷 차림의 캬루가 지닌 특별 주문한 나무 채. 새해의 많은 행복을 바라는 마음이 무수히 많은 깃털 공을 만들어내고, 온갖 재난을 물리친다.",98,1,0,0,1,0.0,0.0,74.0,0.0,0.0,0.0,10.0,0.0,25.0,0.0,0.0,0.0,0.0,0.0,0.0,0.0,0,0.0
131211,"신전 무녀의 방울 장식","신전에서 무녀 일을 하는 스즈메가 지닌 무령. 대대로 이어온 무녀들의 기도가 담겨 있어 방울 소리가 닿는 범위의 악한 기운을 정화한다.",98,1,0,0,1,0.0,0.0,67.0,0.0,0.0,0.0,0.0,0.0,0.0,0.0,0.0,0.0,0.0,10.0,3.0,0.0,0,0.0
131221,"매지컬 미스티 로드","마법 탐정 미스티★카스미가 다루는 마법의 지팡이. 사랑과 희망의 힘을 담아서 사악한 적을 붙잡고, 어떤 진실도 밝히는 빛을 발한다.",98,1,0,0,1,0.0,0.0,52.0,4.0,6.0,0.0,0.0,0.0,0.0,0.0,0.0,0.0,0.0,0.0,0.0,0.0,0,0.0
131231,"매지컬 퓨어리 보우","마법 사냥꾼 퓨어리★시오리가 다루는 마법의 활. 사랑과 희망의 힘을 담아서 어떤 사악한 적도 꿰뚫는 필살의 화살을\n쏠 수 있다.",98,1,0,0,1,0.0,84.0,0.0,0.0,0.0,40.0,0.0,0.0,0.0,0.0,0.0,0.0,0.0,0.0,0.0,0.0,0,0.0
131241,"스테이지 오브 큐트","우즈키가 지닌 정통적인 검. 특별한 힘은 없어 보이지만 우즈키의 미소와 따뜻한 마음에 따라 반짝이고, 숨겨진 힘을 발휘한다.",98,1,0,0,1,0.0,82.0,0.0,0.0,0.0,34.0,0.0,0.0,0.0,0.0,0.0,0.0,0.0,0.0,1.0,0.0,0,0.0
131251,"스테이지 오브 쿨","린이 다루는 푸르고 아름다운 검. 쿨하게 불타는 린의 뜨거운 마음에 호응해서 푸른 빛을 발하고, 한없이 높은 곳을 목표로 계속 달리는 그녀의 여로를 비춘다.",98,1,0,0,1,220.0,0.0,0.0,8.0,8.0,0.0,0.0,0.0,0.0,0.0,0.0,0.0,0.0,0.0,0.0,0.0,0,0.0
131261,"스테이지 오브 패션","미오가 애용하는 반짝이는 별 지팡이. 미오의 밝은 노랫소리에 따라 작은 유성을 불러들여, 노래하는 모습이 스페이스 오페라와 같다.",98,1,0,0,1,0.0,0.0,90.0,0.0,0.0,0.0,16.0,0.0,0.0,0.0,0.0,0.0,0.0,0.0,0.0,0.0,0,0.0
131271,"도토리 레인저 랜스","린의 엄마가 갑옷과 함께 사준 사랑이 잔뜩 담긴 창. 엄청난 경도를 자랑하지만 매우 가벼워 린의 힘으로도 자유자재로 휘두를 수 있다.",98,1,0,0,1,0.0,78.0,0.0,0.0,0.0,25.0,0.0,0.0,0.0,0.0,0.0,0.0,0.0,0.0,2.0,0.0,0,0.0
131281,"엘리자베스 포크","목장에 대대로 전해지는 유서 깊은 장비. 마물로부터 목장을 지키기 위한 것이지만 평소 동물들을 돌보는 데도 활용할 수 있도록 농기구와 비슷한 형태이다.",98,1,0,0,1,0.0,87.0,0.0,0.0,0.0,26.0,0.0,0.0,0.0,0.0,0.0,0.0,0.0,0.0,0.0,0.0,0,0.0
131291,"원더랜드 보우","이상한 책 속에서 앨리스의 힘을 얻은 리노의 활. 앨리스와 마음이 통해 구세주로서의 힘을 해방하고 세계를 구할 일격을 가한다.",98,1,0,0,1,0.0,80.0,0.0,0.0,0.0,30.0,0.0,0.0,0.0,0.0,0.0,0.0,0.0,0.0,1.0,0.0,0,0.0
131301,"원더랜드 클락","이상한 책 속에서 아유미가 갖고 있던 창. 주위로부터 끝없이 기색을 지워, 시간의 흐름을 멈출 정도의 효과를 발휘하는 아유미한테 딱 알맞은 창.",98,1,0,0,1,210.0,0.0,0.0,10.0,0.0,0.0,0.0,0.0,0.0,3.0,0.0,0.0,0.0,0.0,0.0,1.0,0,0.0
131311,"절해 파랑환 존위","루카가 차고 다니는 명검, 절해와 요력,\n파랑환의 두 자루 검. 소유주에게 맞춰 여름 복장으로 만든 일품. 불변의 날카로움은 흰 파도까지 가른다.",98,1,0,0,1,0.0,94.0,0.0,0.0,0.0,13.0,0.0,0.0,0.0,0.0,0.0,0.0,0.0,0.0,0.0,0.0,0,0.0
131321,"해마옥멸박쇄묘","바다 감옥에 강림해 질풍의 명희가 그 몸에\n걸친 저주받은 박쇄의 닻. 봉인된\n포학한 용이 포효할 때, 지옥의\n망자조차 떨며 도망치려고 허둥댄다.",98,1,0,0,1,0.0,0.0,82.0,0.0,0.0,0.0,8.0,0.0,0.0,0.0,0.0,0.0,0.0,0.0,2.0,0.0,0,0.0
131331,"나나카 서머 큐트 로드","여름 복장을 한 나나카가 지닌 마법의 지팡이. 천재 마법 소녀가 여름의 두근거림을 느꼈을 때 숨겨진 진짜 힘이 해방되는 것이다!",98,1,0,0,1,0.0,0.0,91.0,0.0,0.0,0.0,0.0,0.0,0.0,0.0,0.0,0.0,0.0,0.0,2.0,0.0,0,0.0
131341,"글리터 스타스☆퐁퐁","하츠네가 청춘에 모든 것을 바친 자에게 기라성의 성원을 보내는 퐁퐁. 일곱가지 색의 응원은 해변을 칠하고 어떤 역경도 극복해 꿈을 향한 길을 개척한다.",98,1,0,0,1,0.0,0.0,88.0,0.0,0.0,0.0,13.0,0.0,0.0,0.0,0.0,0.0,0.0,0.0,0.0,0.0,0,0.0
131351,"비치 비너스 메가폰","미사토가 청춘에 모든 것을 바친 자에게 자애의 목소리를 전하는 메가폰. 해변의 성모가 보내는 응원은 몸속에서 힘을 솟게 해 꿈을 향한 뒷받침을 한다.",98,1,0,0,1,0.0,0.0,30.0,0.0,12.0,0.0,0.0,0.0,0.0,0.0,0.0,0.0,0.0,0.0,2.0,0.0,0,0.0
131361,"서머 슈발리에 소드","쥰이 비번을 바다에서 보내기 위해 맞춘 시원한 대검. 겉모양과 달리 나오는 공격은 한여름의 태양처럼 작열.",98,1,0,0,1,100.0,89.0,0.0,0.0,0.0,0.0,0.0,0.0,0.0,0.0,0.0,0.0,0.0,0.0,0.0,0.0,0,0.0
131371,"해피 엔젤 보우","천사가 된 아카리가 지닌 천계의\n활. 지팡이로 사용하는 것도\n가능하고 짝이 되는 요리의 화살과 조합하면 진가를 발휘한다.",98,1,0,0,1,0.0,0.0,80.0,0.0,0.0,0.0,13.0,0.0,0.0,0.0,0.0,0.0,0.0,0.0,2.0,0.0,0,0.0
131381,"해피 엔젤 애로우","천사가 된 요리가 지닌 천계의\n화살. 창으로 사용하는 것도\n가능하고 짝이 되는 아카리의 활과 조합하면 진가를 발휘한다.",98,1,0,0,1,300.0,0.0,64.0,0.0,0.0,0.0,0.0,0.0,0.0,0.0,0.0,0.0,0.0,0.0,1.0,0.0,0,0.0
131391,"할로윈 나이트 드레스","흡혈귀를 이미지로 한 츠무기가 직접 만든\n신작 드레스. 쿨과 큐트를 양립시킨 약간 달콤씁쓸한 코디로 공격 자세를 어필.",98,1,0,0,1,75.0,0.0,0.0,9.0,9.0,0.0,0.0,0.0,0.0,0.0,0.0,0.0,0.0,0.0,1.0,0.0,0,0.0
131401,"뷰티 할로우","츠무기가 만든 레이의 전용 드레스. 여기저기 섬세한 장식이 더해지고 레이의 검술을 방해하지 않도록 기능성도 배려된 아름다운 할로윈 의상.",98,1,0,0,1,0.0,95.0,0.0,0.0,0.0,12.0,0.0,0.0,0.0,0.0,0.0,0.0,0.0,0.0,1.0,0.0,0,0.0
131411,"화이트 타이거 폼","할로윈 밤에 마츠리가 획득한\n새로운 변신 폼…이라는 설정의\n새 코스튬. 츠무기가 직접 만든 것으로\n착용감 발군, 만듦새도 튼튼하다.",98,1,0,0,1,0.0,94.0,0.0,0.0,0.0,20.0,0.0,0.0,0.0,0.0,0.0,0.0,0.0,0.0,0.0,0.0,0,0.0
131421,"매지컬 러블리 소드","마법 제독 러블리★모니카가 다루는 마법의 검. 사랑과 희망의 힘을 담아 동료들을 고무하고 어떠한 사악한 적이라도 마주할 용기를 준다.",98,1,0,0,1,0.0,98.0,0.0,0.0,0.0,12.0,0.0,0.0,0.0,0.0,0.0,0.0,0.0,0.0,0.0,0.0,0,0.0
131431,"매지컬 샤이니 레이피어","마법검사 샤이니★토모가 다루는 마법의 가느다란 검. 사랑과 희망의 힘을 담아 어떠한 사악한 적이라도 처부수는 강렬한 일격을 가할 수 있다.",98,1,0,0,1,0.0,70.0,0.0,0.0,0.0,0.0,75.0,0.0,0.0,0.0,0.0,0.0,0.0,0.0,0.0,0.0,0,0.0
131441,"위스타리아 노엘 드레스","아키노의 크리스마스 드레스. 위스\n타리아가가 고용한 재단사가 만든 것으로\n호화찬란하면서 꾸밈 없고 강건한\n장비로도 훌륭한 일품이다.",98,1,0,0,1,0.0,92.0,0.0,0.0,0.0,15.0,0.0,0.0,0.0,0.0,0.0,0.0,0.0,0.0,0.0,0.0,0,0.0
131451,"사렌디아 노엘 드레스","사렌을 위해 스즈메와 아이들이 준비한 크리스마스용 파티 드레스. 낡은 드레스를 고쳐 만든 모두의 마음이 가득 담긴 한 벌.",98,1,0,0,1,0.0,85.0,0.0,0.0,0.0,15.0,0.0,0.0,0.0,0.0,0.0,0.0,0.0,6.0,0.0,0.0,0,0.0
131461,"크리스마스 로얄 글라스","유카리가 크리스마스를 위해 준비한 특별한 칵테일 잔. 톡톡 튀는 브랜디가 고양감과 함께 최고의 크리스마스이브를 연출해준다.",98,1,0,0,1,100.0,84.0,0.0,0.0,0.0,0.0,0.0,0.0,0.0,0.0,0.0,0.0,0.0,0.0,1.0,0.0,0,0.0
131471,"대악당의 신춘 나들이옷","무이미가 오마를 구한 답례로 마을 주민들이 선물한 나들이옷. 대악당다움이 넘치는 호쾌한 옷맵시로, 난투극을 벌여도 걱정 없다.",98,1,0,0,1,0.0,61.0,0.0,4.0,4.0,0.0,0.0,0.0,0.0,0.0,0.0,0.0,0.0,0.0,0.0,0.0,0,0.0
131501,"신춘 환영 전통 우산","나들이옷 차림의 네네카가 가진 우산. 한번 우산을 펴면 환영 마법이 흘러 넘쳐, 본 사람의 정신을 몽환의 우리에 계속 가두고 놓지 않는다고 한다.",98,1,0,0,1,0.0,0.0,85.0,0.0,0.0,0.0,0.0,0.0,0.0,0.0,0.0,0.0,0.0,6.0,1.0,0.0,0,0.0
